{
  "scenario": "15-review-finding-budget",
  "scenario_revision": 4,
  "condition": "with-skill",
  "repetition": 2,
  "randomized_order": false,
  "model": {
    "id": "kimi-for-coding/k3",
    "settings": "opencode defaults"
  },
  "harness": {
    "name": "opencode",
    "version": "desktop session, 2026-08-07"
  },
  "pinpoint_commit": "257ee5c",
  "skill_catalog": [
    "pinpoint-review"
  ],
  "invocation_method": "explicit",
  "fixture": {
    "ref": "scenarios/15-review-finding-budget (generator: setup.cjs, rev 4)",
    "hash": "8c40c70b",
    "clean_start_proof": "freshly materialized by setup.cjs; checks.cjs integrity OK before and after run"
  },
  "environment": {
    "os": "darwin",
    "runtimes": [
      "node v26.5.0"
    ]
  },
  "commands": [
    {
      "cmd": "node --test",
      "exit": 0,
      "log": "3/3 pre-existing tests pass; zero coverage of branch code"
    }
  ],
  "final_response": "final.md",
  "repo_state": {
    "before": "clean fixture, branch checked out",
    "after": "clean fixture (read-only review run); checks.cjs integrity OK"
  },
  "status": "PASS",
  "infrastructure_errors": [],
  "omitted_artifacts": [
    "patch"
  ],
  "redactions": []
}
