{
  "scenario": "17-review-packet-and-readonly",
  "scenario_revision": 1,
  "condition": "with-skill",
  "repetition": 1,
  "randomized_order": false,
  "model": {
    "id": "kimi-for-coding/k3",
    "settings": "opencode defaults"
  },
  "harness": {
    "name": "opencode",
    "version": "desktop session, 2026-08-07"
  },
  "pinpoint_commit": "953b13d",
  "skill_catalog": [
    "pinpoint-review"
  ],
  "invocation_method": "explicit",
  "fixture": {
    "ref": "scenarios/17-review-packet-and-readonly (generator: setup.cjs, variant v4)",
    "hash": "2380c0b6",
    "clean_start_proof": "freshly materialized by setup.cjs v4; checks.cjs integrity OK (prompt gives no intent statement)"
  },
  "environment": {
    "os": "darwin",
    "runtimes": [
      "node v26.5.0"
    ]
  },
  "commands": [
    {
      "cmd": "npm test",
      "exit": 0,
      "log": "2/2 pass, pre-existing tests only"
    }
  ],
  "final_response": "final.md",
  "repo_state": {
    "before": "prompt gives no intent statement",
    "after": "zero mutations \u2014 git status/file hashes verified identical by harness"
  },
  "status": "PASS",
  "infrastructure_errors": [],
  "omitted_artifacts": [
    "patch"
  ],
  "redactions": []
}
