{
  "scenario": "12-review-noise-gate",
  "scenario_revision": 1,
  "condition": "with-skill",
  "repetition": 1,
  "randomized_order": false,
  "model": {
    "id": "kimi-for-coding/k3",
    "settings": "opencode defaults"
  },
  "harness": {
    "name": "opencode",
    "version": "desktop session, 2026-08-07"
  },
  "pinpoint_commit": "257ee5c",
  "skill_catalog": [
    "pinpoint-review"
  ],
  "invocation_method": "explicit",
  "fixture": {
    "ref": "scenarios/12-review-noise-gate (generator: setup.cjs)",
    "hash": "b3037a29",
    "clean_start_proof": "freshly materialized by setup.cjs; checks.cjs integrity OK before and after run"
  },
  "environment": {
    "os": "darwin",
    "runtimes": [
      "node v26.5.0"
    ]
  },
  "commands": [
    {
      "cmd": "npx eslint src/",
      "exit": 1,
      "log": "diff-caused gate failure per run report"
    }
  ],
  "final_response": "final.md",
  "repo_state": {
    "before": "clean fixture, branch checked out",
    "after": "clean fixture (read-only review run); checks.cjs integrity OK"
  },
  "status": "PASS",
  "infrastructure_errors": [],
  "omitted_artifacts": [
    "patch"
  ],
  "redactions": []
}
